{
  "schema_version": "central-inference-module-gate-summary/v1",
  "test_id": "TEST-INF-MODULE-GATES-001",
  "requirement_ids": [
    "MOD-INF-001",
    "ARCH-005",
    "ARCH-MODEL-001",
    "CONTRACT-INFERENCE-001",
    "CONTRACT-MODEL-001",
    "FUNC-INF-001",
    "FUNC-INF-MODEL-001",
    "PERF-INF-001",
    "REL-INF-001",
    "REL-INF-POOL-001",
    "SEC-TEL-INF-001",
    "DEP-INF-001",
    "OBS-INF-001",
    "TEST-003",
    "TEST-INF-001",
    "TEST-TEL-INF-001",
    "TEST-REAL-E2E-001",
    "DEC-002",
    "DEC-042",
    "DEC-044"
  ],
  "module_id": "MOD-INF-001",
  "run_id": "public-inference-golden-001",
  "generated_at": "2026-08-16T00:00:00Z",
  "level": "MODULE",
  "applicability": "APPLICABLE",
  "result": "HOLD",
  "qualification": "NOT_QUALIFIED",
  "source_revision": "1111111111111111111111111111111111111111",
  "baseline_git_tree": "1111111111111111111111111111111111111111",
  "source_tree_digest": "sha256:1111111111111111111111111111111111111111111111111111111111111111",
  "working_tree_dirty": false,
  "working_tree_status_digest": "sha256:1111111111111111111111111111111111111111111111111111111111111111",
  "artifact_digests": {
    "cmake_presets": "sha256:1111111111111111111111111111111111111111111111111111111111111111",
    "cmake_lock": "sha256:1111111111111111111111111111111111111111111111111111111111111111",
    "inference_contract": "sha256:1111111111111111111111111111111111111111111111111111111111111111",
    "edge_contract": "sha256:1111111111111111111111111111111111111111111111111111111111111111",
    "model_contract": "sha256:1111111111111111111111111111111111111111111111111111111111111111",
    "model_error_contract": "sha256:1111111111111111111111111111111111111111111111111111111111111111",
    "inference_wire_profile": "sha256:1111111111111111111111111111111111111111111111111111111111111111",
    "cpu_runtime_profile": "sha256:1111111111111111111111111111111111111111111111111111111111111111",
    "inference_evidence_schema": "sha256:1111111111111111111111111111111111111111111111111111111111111111",
    "module_findings_schema": "sha256:1111111111111111111111111111111111111111111111111111111111111111",
    "module_findings_registry": "sha256:1111111111111111111111111111111111111111111111111111111111111111",
    "qualification_profile": "sha256:1111111111111111111111111111111111111111111111111111111111111111",
    "soak_profile": "sha256:1111111111111111111111111111111111111111111111111111111111111111",
    "traceability_manifest": "sha256:1111111111111111111111111111111111111111111111111111111111111111",
    "traceability_evidence": "sha256:1111111111111111111111111111111111111111111111111111111111111111",
    "requirements_baseline": "sha256:1111111111111111111111111111111111111111111111111111111111111111",
    "release_binary": "sha256:1111111111111111111111111111111111111111111111111111111111111111",
    "oci_evidence": "sha256:1111111111111111111111111111111111111111111111111111111111111111",
    "deep_check_evidence": "sha256:1111111111111111111111111111111111111111111111111111111111111111",
    "supply_chain_evidence": "sha256:1111111111111111111111111111111111111111111111111111111111111111",
    "numeric_golden_evidence": "sha256:1111111111111111111111111111111111111111111111111111111111111111",
    "formal_soak_evidence": "sha256:1111111111111111111111111111111111111111111111111111111111111111",
    "fixture_model": "sha256:1111111111111111111111111111111111111111111111111111111111111111"
  },
  "executed_gates": {
    "gcc_version": "PASS",
    "cmake_version": "PASS",
    "protoc_version": "PASS",
    "public_contract_schema_golden_negative": "PASS",
    "traceability_manifest": "PASS",
    "traceability_evidence_aggregation": "PASS",
    "format": "PASS",
    "clang_tidy_deny_warnings": "PASS",
    "unit_property_contract_golden": "PASS",
    "numeric_golden_python_reference": "PASS",
    "real_process_public_boundary_blackbox": "PASS",
    "os_enospc_and_fd_exhaustion": {"result": "PASS", "reason": "isolated tmpfs ENOSPC and RLIMIT_NOFILE faults executed"},
    "release_performance_rehearsal": {
      "execution": "PASS",
      "result": "HOLD",
      "qualification": "NOT_QUALIFIED",
      "reason": "correctness/timing recorded; DEC-001 absolute thresholds are not frozen"
    },
    "soak_rehearsal_validation": "PASS",
    "soak_validator_negative_cases": "PASS",
    "module_gate_runner_negative_cases": "PASS",
    "formal_soak_execution": "PASS",
    "formal_soak_validation": "PASS",
    "release_build": "PASS",
    "oci_startup_mtls_probe_graceful_shutdown": {"result": "HOLD", "qualification": "NOT_QUALIFIED"},
    "asan_ubsan_tsan_library_scope": {"result": "HOLD", "qualification": "NOT_QUALIFIED"},
    "supply_chain": {"result": "HOLD", "qualification": "NOT_QUALIFIED"}
  },
  "conditional_applicability": [
    {"profile": "model-runtime-central-cuda/v1", "applicability": "NOT_APPLICABLE", "result": "NOT_RUN", "stable_reason": "CPU_PROFILE_FIRST_RELEASE_ONLY"},
    {"profile": "availability-ha/v1", "applicability": "NOT_APPLICABLE", "result": "NOT_RUN", "stable_reason": "SINGLE_FAILURE_DOMAIN_HOST"},
    {"profile": "tensorrt-future/v1", "applicability": "NOT_APPLICABLE", "result": "NOT_RUN", "stable_reason": "NOT_FIRST_RELEASE_BACKEND"},
    {"profile": "libtorch/v1", "applicability": "NOT_APPLICABLE", "result": "NOT_RUN", "stable_reason": "REJECTED_NOT_FIRST_RELEASE_BACKEND"}
  ],
  "qualification_gates": {
    "absolute_performance": {
      "result": "HOLD",
      "qualification": "NOT_QUALIFIED",
      "reason": "DEC-001 Owner thresholds and exact qualification hardware are not frozen"
    },
    "formal_soak_3600_seconds": {
      "result": "PASS",
      "qualification": "QUALIFIED",
      "command": "MASI_INF_FORMAL_SOAK=1 scripts/run-module-gates.sh",
      "evidence": "formal-soak/formal-soak-evidence.json",
      "evidence_digest": "sha256:1111111111111111111111111111111111111111111111111111111111111111"
    },
    "protected_release_baseline": {
      "result": "HOLD",
      "qualification": "NOT_QUALIFIED",
      "reason": "protected commit/tag attestation and clean release tree are not present"
    },
    "formal_pairwise_and_system_integration": {
      "result": "NOT_RUN",
      "qualification": "NOT_QUALIFIED",
      "reason": "intentionally outside independent module implementation phase"
    }
  },
  "requirement_traceability": {
    "result": "PASS",
    "qualification": "NOT_QUALIFIED",
    "manifest": "infer-cpp/requirements-traceability.json",
    "digest": "sha256:1111111111111111111111111111111111111111111111111111111111111111",
    "evidence_root": "infer-cpp/evidence/module-gates/runs/public-inference-golden-001",
    "summary": "traceability-summary.json",
    "summary_digest": "sha256:1111111111111111111111111111111111111111111111111111111111111111",
    "requirement_count": 20
  },
  "completion": {
    "decision_id": "DEC-044",
    "status": "COMPLETE",
    "known_p0_count": 0,
    "real_startup_test_blocker_count": 0,
    "findings_registry": "infer-cpp/module-findings.json",
    "findings_registry_digest": "sha256:1111111111111111111111111111111111111111111111111111111111111111",
    "blockers": [],
    "criteria": {
      "public_contracts": "PASS",
      "format_lint_static": "PASS",
      "unit_property_contract": "PASS",
      "numeric_golden": "PASS",
      "release_binary": "PASS",
      "real_binary_public_boundary": "PASS",
      "os_fault_recovery": "PASS",
      "real_oci_startup": "PASS",
      "deep_runtime_checks": "PASS",
      "supply_security_checks": "PASS",
      "formal_soak": "PASS",
      "traceability": "PASS",
      "known_p0_zero": "PASS"
    },
    "evidence_digests": {
      "public_contracts": "sha256:1111111111111111111111111111111111111111111111111111111111111111",
      "gcc_version": "sha256:1111111111111111111111111111111111111111111111111111111111111111",
      "cmake_version": "sha256:1111111111111111111111111111111111111111111111111111111111111111",
      "protoc_version": "sha256:1111111111111111111111111111111111111111111111111111111111111111",
      "format": "sha256:1111111111111111111111111111111111111111111111111111111111111111",
      "clang_tidy": "sha256:1111111111111111111111111111111111111111111111111111111111111111",
      "tests": "sha256:1111111111111111111111111111111111111111111111111111111111111111",
      "numeric": "sha256:1111111111111111111111111111111111111111111111111111111111111111",
      "blackbox": "sha256:1111111111111111111111111111111111111111111111111111111111111111",
      "release_build": "sha256:1111111111111111111111111111111111111111111111111111111111111111",
      "os_faults": "sha256:1111111111111111111111111111111111111111111111111111111111111111",
      "oci": "sha256:1111111111111111111111111111111111111111111111111111111111111111",
      "deep": "sha256:1111111111111111111111111111111111111111111111111111111111111111",
      "supply": "sha256:1111111111111111111111111111111111111111111111111111111111111111",
      "formal_soak": "sha256:1111111111111111111111111111111111111111111111111111111111111111",
      "formal_soak_validation": "sha256:1111111111111111111111111111111111111111111111111111111111111111",
      "traceability": "sha256:1111111111111111111111111111111111111111111111111111111111111111"
    }
  },
  "blackbox_e2e": {
    "result": "PASS",
    "endpoint": "127.0.0.1:8011"
  },
  "findings": {
    "open_total": 0,
    "open_p0": 0
  },
  "overall_module_complete": true,
  "overall_status": "HOLD"
}
